Zone ID,Zone,City Code,TCS ID,Centre code,LISP,Add1,Add2,Add3,Pincode,City,State,Max,S1-ME1,S1-EC1,S2-ME2,"S2-BT, CH, GG, MN, PH",S3-ME3,S3-EC2,S4-EC3,"S4-AR, CY, IN, MA, PE",S5-CS1,S5-CE1,S6-CS2,S6-EE1,S7-CE2,"S7-AG, EY, MT, PI",S8-EE2,"S8-AE, TF, XL, XE",PWDFRIENDLY
3,IIT DELHI,5,,3001,Aryabhatta College of Engineering and Research Center,Behind Mahila kalyan Mandal,Chatri Road Chachiyawas,,305001,Ajmer,Rajasthan,205,0,0,112,50,63,138,11,95,131,0,23,108,110,11,94,37,NO
3,IIT DELHI,5,,3002,Aryan College,Near Jaju ITI, Lohagal Road,,305001,Ajmer,Rajasthan,173,0,0,107,48,53,116,11,95,137,0,24,113,117,12,94,37,NO
3,IIT DELHI,5,,3003,St. Willfred Institute of Engineering and Technology,Gegal  Near Balaji,Jaipur Road,,305023,Ajmer,Rajasthan,114,0,0,67,30,35,77,0,0,0,0,0,0,0,0,0,0,NO
3,IIT DELHI,10,,3004,Modern Institute of Technology and Research Centre,6 th Mile Stone Vill. Jharkhera Sirmoli Road,Delhi - Tijara Highway,,301028,Alwar,Rajasthan,455,0,0,221,35,183,141,68,70,150,65,0,205,200,5,181,22,YES
3,IIT DELHI,131,,3005,PDM Group Of Institutions-Engineering Block,Sector 3A Sarai Aurangabad,Bahadurgarh, Jhajjar,124507,Bahadurgarh,Haryana,455,222,223,101,359,205,199,12,437,202,202,202,202,413,38,276,175,NO
3,IIT DELHI,21,,3006,PDM Group Of Institutions-Technology & Management Block,Sector 3A Sarai Aurangabad,Bahadurgarh ,Jhajjar,124507,Bahadurgarh,Haryana,455,0,0,199,72,116,227,18,128,74,80,104,123,77,5,0,26,YES
3,IIT DELHI,37,,3007,Government Engineering College Bikaner,Karni Industrial Area,Pugal Road,,334004,Bikaner,Rajasthan,246,61,95,96,24,0,0,0,0,206,27,0,243,221,2,172,61,YES
3,IIT DELHI,37,,3008,Marudhar Engineering College,Raisar NH-11,,,334001,Bikaner,Rajasthan,219,59,92,96,24,0,0,37,92,0,0,0,0,0,0,0,0,YES
3,IIT DELHI,49,,3009,ABES Institute of Technology,Campus 2  19th Km Stone  NH 24,Vijay Nagar,,201009,Ghaziabad,Uttar Pradesh,437,361,95,76,380,346,92,334,104,53,100,87,65,55,20,236,101,YES
3,IIT DELHI,49,,3010,G. L. B. Institute of Technology and Management,Plot no. 2,Knowledge Park - III,,201308,Greater Noida,Uttar Pradesh,546,450,119,95,475,433,114,417,130,66,125,109,81,0,0,0,0,YES
3,IIT DELHI,49,,3011,Greater Noida College of Technology,Plot No. 6B,Knowledge Park II,,201306,Greater Noida,Uttar Pradesh,191,0,0,0,0,152,40,146,46,22,42,38,29,0,0,0,0,NO
3,IIT DELHI,49,,3012,Greater Noida Institute of Technology,Plot no 7,Knowledge park -II,,201306,Greater Noida,Uttar Pradesh,637,525,139,110,554,505,133,486,152,77,146,127,94,0,0,0,0,NO
3,IIT DELHI,49,,3013,IEC Group of Institutions,Plot No.4, Institutional Area,,201306,Greater Noida,Uttar Pradesh,228,188,50,40,199,181,48,174,55,27,51,46,34,0,0,0,0,NO
3,IIT DELHI,49,,3014,IIMT College of Management,Plot No. A-20,Knowledge Park III,,201308,Greater Noida,Uttar Pradesh,637,525,139,110,554,505,133,486,152,77,146,127,94,0,0,0,0,NO
3,IIT DELHI,49,,3015,Indraprashtha College of Engineering,63  Site IV  Surya Nagar Flyover Road,Sahibabad,,201010,Ghaziabad,Uttar Pradesh,455,375,99,79,396,361,95,348,108,55,104,91,67,55,20,247,106,NO
3,IIT DELHI,49,,3016,ITS Engineering College,Plot No. 46,Knowledge  Park -III,,201308,Greater Noida,Uttar Pradesh,364,300,80,63,317,289,76,278,87,44,84,73,54,0,0,0,0,NO
3,IIT DELHI,49,,3017,Mangalmay Institute of Engineering Technology,Plot No 8,Knowledge Park - II,,201310,Greater Noida,Uttar Pradesh,250,207,55,44,218,198,53,191,60,30,56,50,37,0,0,0,0,NO
3,IIT DELHI,49,,3018,Noida Institute of Engineering & Technology Greater Noida,Plot No.19,Knowledge Park-II Institutional Area,,201306,Greater Noida,Uttar Pradesh,500,413,109,87,435,396,105,382,119,59,111,100,74,0,0,0,0,NO
3,IIT DELHI,49,,3019,Sharda University,Plot no. 32-34,Knowledge park III,,201306,Greater Noida,Uttar Pradesh,546,450,119,95,475,433,114,417,130,66,125,109,81,0,0,0,0,NO
3,IIT DELHI,56,,3020,Aravali College of Engineering & Management,Village Jasana, Jasana Tigaon Road,,121004,Faridabad,Haryana,182,15,15,74,25,46,38,24,36,12,39,59,17,26,5,15,6,NO
3,IIT DELHI,56,,3021,B S Anangpuria Educational Institute,Village Alampur ,Ballabgarh-Sohna Road,,121004,Faridabad,Haryana,228,0,0,0,0,57,47,27,40,13,43,74,21,0,0,0,0,NO
3,IIT DELHI,56,,3022,Manav Rachna University,Aravali Campus Sector 43  ,Delhi Surajkund Road, Aravli Hills,121004,Faridabad,Haryana,1000,67,67,308,104,250,204,40,60,53,178,322,91,42,8,66,27,YES
3,IIT DELHI,56,,3023,Rawal Institute of Engineering and Technology,Sohna Road  ,Near Zakopur Village,,121004,Faridabad,Haryana,246,20,20,99,34,62,51,32,48,16,52,80,23,34,6,20,8,NO
3,IIT DELHI,56,,3024,YMCA University Of Science And Technology,NH-2 Sec-6  ,Mathura Road,,121006,Faridabad,Haryana,137,0,0,0,0,35,28,17,26,9,28,45,13,0,0,0,0,NO
3,IIT DELHI,64,,3025,DPG Institute Of Technology And Management,Near Marble Market ,Sector 34,,122004,Gurgaon,Haryana,237,14,14,96,28,66,80,23,68,14,65,113,24,0,0,0,0,YES
3,IIT DELHI,64,,3026,Dronacharya College Of Engineering Gurgaon,Khentawas, Farukh Nagar,,123506,Gurgaon,Haryana,455,27,27,166,48,126,152,30,88,27,127,217,46,0,0,0,0,NO
3,IIT DELHI,64,,3027,Gurgaon College of Engineering,Village Pathreri Bilaspur Chowk,NH-8,,122413,Gurgaon,Haryana,664,40,40,274,79,183,222,30,88,40,187,317,67,100,23,150,85,NO
3,IIT DELHI,64,,3028,KIIT College of Engineering,KIIT Campus Sohna Road,Bhondsi,,122102,Gurgaon,Haryana,346,21,21,104,30,96,116,30,88,21,96,165,35,0,0,0,0,NO
3,IIT DELHI,70,,3029,OM Institute Of Technology and Management,12 KM Stone VPO Juglan,VPO Juglan Hisar-Chandigarh Road,,125001,Hisar,Haryana,723,199,243,217,224,200,243,83,360,163,293,414,212,210,30,136,127,Yes
3,IIT DELHI,76,,3030,Acropolis Institute Of Technology & Research,Dewas Bypass Road,Manglia Square,Near Toll Plaza,453771,Indore,Madhya Pradesh,382,0,0,148,73,188,173,20,66,143,238,90,111,0,0,0,0,YES
3,IIT DELHI,76,,3031,Acropolis Technical Campus Indore,Indore Bypass Road,Near Rala Mandal Village Tillore ,,452020,Indore,Madhya Pradesh,328,0,0,128,63,152,140,20,66,121,200,90,111,0,0,0,0,NO
3,IIT DELHI,76,,3032,Indore Institute Of Science and Technology,Pithampur Road,Opposite IIM  Rau,,453331,Indore,Madhya Pradesh,273,0,0,100,49,132,122,19,65,102,169,81,100,0,0,0,0,NO
3,IIT DELHI,76,,3033,Institute of Engineering and Science IPS Academy,Rajendra Nagar,AB Road,,452012,Indore,Madhya Pradesh,437,0,0,172,84,218,201,20,66,162,269,90,111,202,52,0,80,YES
3,IIT DELHI,76,,3034,Lakshmi Narain College of Technology & Science,Revati  Sanwer Road,Near Aurbindo Hospital,,453331,Indore,Madhya Pradesh,219,0,0,0,0,0,0,0,0,81,134,81,100,0,0,0,0,NO
3,IIT DELHI,76,,3035,Malwa Institute of Science & Technology,Village Limbodagari  Behind Aurbindo Hospital,Sanwer Road,,453111,Indore,Madhya Pradesh,219,0,0,0,0,0,0,0,0,79,132,81,100,0,0,0,0,NO
3,IIT DELHI,76,,3036,Medicaps Institute Of Technology & Management,A.B. Road Rau Pigdamber,Near Hotel Mashal,,453331,Indore,Madhya Pradesh,437,0,0,168,82,218,201,20,66,162,269,90,111,199,52,0,75,NO
3,IIT DELHI,76,,3037,Oriental University Indore,Opp. Revati Range Gate No.1,Post Aurbindo Sanwer Road Jakhya,,453555,Indore,Madhya Pradesh,273,0,0,0,0,132,122,18,62,102,169,81,100,0,0,0,0,YES
3,IIT DELHI,76,,3038,Orlando Academy,20-21  Press Complex 1st Floor above  Mahanagar Press,Behind Dainik Bhaskar,,452001,Indore,Madhya Pradesh,219,0,0,0,0,0,0,0,0,79,132,81,100,0,0,0,0,NO
3,IIT DELHI,76,,3039,Sanghavi Institute Of Management and Science,Behind IIM Near Indore,Cancer Care Foundation Trust Pigdambar  Rau,,453331,Indore,Madhya Pradesh,273,0,0,0,0,132,122,18,62,102,169,81,100,0,0,0,0,NO
3,IIT DELHI,76,,3040,Truba College Of Engineering & Technology Indore, Kailod Kartal,By-Pass Road,,453331,Indore,Madhya Pradesh,273,0,0,100,49,133,123,20,66,102,169,81,101,0,0,0,0,NO
3,IIT DELHI,78,,3041,Arya College of Engineering and Information Technology,Arya OLD Main Campus  S.P.42,RIICO Industrial Area Delhi Road Kukas,,302028,Jaipur,Rajasthan,864,425,342,293,174,402,342,166,303,210,655,283,582,367,34,753,72,YES
3,IIT DELHI,78,,3042,Global Institute Of Technology,ITS-1  IT Park EPIP,Sitapura,,302022,Jaipur,Rajasthan,637,286,231,303,180,270,231,89,162,151,470,203,418,275,26,567,54,NO
3,IIT DELHI,78,,3043,Jaipur Engineering College,SP-43  RIICO Industrial Area,Delhi Road  Kukas,,302028,Jaipur,Rajasthan,546,286,231,303,180,270,231,89,162,132,409,177,364,367,34,457,44,NO
3,IIT DELHI,78,,3044,Vivekananda Global University,Sector 36 NRI Road,Jagatpura Road Jagatpura,,303012,Jaipur,Rajasthan,253,143,116,152,90,135,116,89,162,61,190,82,169,0,0,0,0,NO
3,IIT DELHI,78,,3045,Maharishi Arvind College of Engineering and Research Center Jaipur,Sirsi Road ,Near Kanakpura Railway Station,,302012,Jaipur,Rajasthan,346,0,0,0,0,0,0,0,0,84,261,113,232,229,22,313,30,NO
3,IIT DELHI,78,,3046,Swami Keshvanand Institute Of Technology Management and Gramothan Jaipur,Ram Nagaria,Jagatpura,,302017,Jaipur,Rajasthan,364,0,0,0,0,0,0,0,0,89,276,119,246,229,22,329,32,NO
3,IIT DELHI,78,,3047,Vivekananda Institute of Technology,Sector 36 NRI Road,Sisyawas  Jagatpura,,303012,Jaipur,Rajasthan,273,143,116,152,90,135,116,89,162,61,190,82,169,0,0,0,0,NO
3,IIT DELHI,78,,3048,Vivekananda Institute of Technology East,Sector 36 NRI Road,Sisyawas  Jagatpura,,303012,Jaipur,Rajasthan,273,143,116,152,90,135,116,89,162,61,190,82,169,0,0,0,0,NO
3,IIT DELHI,81,,3049,Azad Institute of Information Technology,AGI Building  Sunjwan Road,Near Wave Mall,,181152,Jammu,Jammu and Kashmir,110,52,54,42,61,36,70,53,48,60,55,59,55,83,14,61,45,YES
3,IIT DELHI,81,,3050,Heritage School,Sec D,Sanik Colony,,180001,Jammu,Jammu and Kashmir,91,42,43,36,52,29,56,46,42,48,44,47,44,67,11,49,36,YES
3,IIT DELHI,81,,3051,Kawa Institute Of Management And Technology,Kawa Tower  NH Bye-Pass Road,Narwal,,180006,Jammu,Jammu and Kashmir,99,43,44,38,54,30,58,47,43,50,46,49,46,70,12,55,41,YES
3,IIT DELHI,81,,3052,Model Institute of Engineering & Technology,Kot Balwal,,,181122,Jammu,Jammu and Kashmir,88,38,39,35,51,26,51,42,38,46,43,45,43,65,11,44,33,YES
3,IIT DELHI,81,,3053,Shri Mata Vaishno Devi University,Kakryal (Katra),,,182320,Jammu,Jammu and Kashmir,137,65,67,52,75,45,87,69,62,71,67,70,66,100,17,79,58,YES
3,IIT DELHI,83,,3054,JIET School of Engineering & Technology for Girls, NH 65 Mogra,New Pali Road,,342802,Jodhpur,Rajasthan,182,85,61,68,78,85,62,95,51,81,80,41,120,125,7,148,31,NO
3,IIT DELHI,83,,3055,Marwar Engineering College & Research Center,Highway No. 112,P.O Vill.- Kharda Bhandu  Barmer Roa,,342001,Jodhpur,Rajasthan,246,117,85,93,108,117,84,132,69,117,115,57,170,125,7,167,35,YES
3,IIT DELHI,83,,3056,MAULANA AZAD UNIVERSITY,Kamla Nehru Nagar  Muslim School Campus,Pal Link Road,,342001,Jodhpur,Rajasthan,200,0,0,0,0,0,0,0,0,87,86,45,132,0,0,0,0,NO
3,IIT DELHI,93,,3057,R.P. Inderaprastha Institute of Technology,G.T  ROAD Village Bastara,Near Madhuban,,132117,Karnal,Haryana,200,0,0,107,78,102,83,70,80,0,55,174,3,63,3,69,30,YES
3,IIT DELHI,102,,3058,GLOBAL PUBLIC SCHOOL,A2 INDRA VIHAR,Talwandi,,324005,Kota,Rajasthan,91,0,0,0,0,0,0,0,0,53,28,0,82,86,7,71,8,NO
3,IIT DELHI,102,,3059,Maharishi Arvind College of Engineering and Technology,IPB-21 RIICO Institutional Area,Ranpur,,325003,Kota,Rajasthan,237,101,85,126,55,96,85,71,110,131,69,0,214,175,14,204,23,NO
3,IIT DELHI,102,,3060,Maharishi Arvind International Institute of Technology,IPA-1 RIICO Institutional Area,Jhalawar Road  Ranpur,,325003,Kota,Rajasthan,237,100,85,124,55,95,85,71,108,129,68,0,214,175,14,202,23,YES
3,IIT DELHI,102,,3061,Rajeev Gandhi Computer Saksharta Mission,Raj Rani Tower H-1-6 IT Park Road No.4 ,Indraprasth Industrial Area,Road No 4 Jhalawa Road,324005,Kota,Rajasthan,100,0,0,0,0,0,0,0,0,53,28,0,92,86,7,80,9,YES
3,IIT DELHI,116,,3062,GLA University,17 km Stone  NH-2 Mathura-Delhi Road,P.O. Chaumuhan,,281406,Mathura,Uttar Pradesh,364,228,73,169,27,0,0,124,77,0,188,260,30,120,9,182,12,YES
3,IIT DELHI,116,,3063,Sanskriti Group of Institutions,28 K.M. Stone,Mathura  Delhi Highway Chhata,,281401,Mathura,Uttar Pradesh,200,132,43,156,25,0,0,0,0,0,0,0,0,0,0,0,0,YES
3,IIT DELHI,131,,3064,Arwachin Bharti Bhawan Sr.Sec School,C- Block,Vivek Vihar,,110095,New Delhi,Delhi,319,153,154,67,239,145,141,8,291,143,143,143,143,293,27,196,124,YES
3,IIT DELHI,131,,3065,Asia Pacific Institute of Management,No 3 and 4  Institutional Area Jasola , Opposite Sarita Vihar,,110025,New Delhi,Delhi,328,158,158,67,239,150,145,8,291,147,147,147,147,301,28,201,128,NO
3,IIT DELHI,131,,3066,Computer Junction Pvt. Ltd.,F-62  Okhla Industrail Area  Phase-1,Near Mercedes Service Centre,,110020,New Delhi,Delhi,337,163,163,67,239,154,149,8,291,151,151,151,151,309,29,207,131,NO
3,IIT DELHI,131,,3067,Computer Junction Pvt. Ltd.,C-129,Naraina Industrial Area Phase I,Near Coffee Day,110028,New Delhi,Delhi,364,178,178,67,239,166,161,8,291,163,163,163,163,334,31,223,142,NO
3,IIT DELHI,131,,3068,Delhi School of Business,VIPS-TC AU Outer Block, Outer Ring road Pitampura,,110034,New Delhi,Delhi,273,134,134,61,215,125,121,7,262,123,123,123,123,250,24,167,107,YES
3,IIT DELHI,131,,3069,Fringe Institute of Advanced Studies,234  Budhpur,GT Karnal Road Near Jain Mandir ,,110036,New Delhi,Delhi,137,0,0,0,0,63,61,4,127,62,62,62,62,0,0,0,0,YES
3,IIT DELHI,131,,3070,Lakshya Institute of Management and Technology,Opposite D-157 MUNSI RAM YADAV BHAVAN,Village Baghdola Sector 8 Dwarka,Nar CRPF Camp Sector 8 Metro Station,110077,New Delhi,Delhi,228,109,109,49,176,104,101,6,214,103,103,103,103,209,20,140,89,NO
3,IIT DELHI,131,,3071,New Delhi Institute of Management,60 and 50  B and C ,Tughlakabad Institutional Area,,110062,New Delhi,Delhi,100,0,0,0,0,46,45,3,97,45,45,45,45,0,0,0,0,NO
3,IIT DELHI,131,,3072,Ojas Global Academy,A-1 Rajiv nagar  Begumpur ,Opp. Sector-22  Rohini,Near MAIT,110086,Delhi,Delhi,455,218,218,98,351,207,201,8,291,204,204,204,204,417,39,279,177,NO
3,IIT DELHI,131,,3073,Ojas Institute Of Management,B-1  Sector 16  Rohini,Near Bansal Bhawan,,110089,New Delhi,Delhi,273,134,134,61,215,125,121,7,262,123,123,123,123,250,24,167,107,NO
3,IIT DELHI,131,,3074,Online Edu Solutions,D-4  Kalkaji,,,110019,New Delhi,Delhi,200,99,99,45,160,91,89,6,194,90,90,90,90,184,17,123,78,NO
3,IIT DELHI,131,,3075,Online Infra,A-22 1st floor,Vivek vihar Phase-2,,110095,Delhi,Delhi,100,0,0,0,0,46,45,3,97,45,45,45,45,0,0,0,0,NO
3,IIT DELHI,131,,3076,R Infoline,B1/D4  1ST FLOOR MOHAN COOPERATIVE INDUSTRIAL ESTATE,MATHURA ROAD,,110044,New Delhi,Delhi,182,89,89,41,144,83,81,5,175,82,82,82,82,167,16,112,71,YES
3,IIT DELHI,131,,3077,Shivam Online Education and Caliber Testing Lab PVT LTD,B-13  DSIDC Complex Patparganj,Industrial Area,,110092,New Delhi,Delhi,210,104,104,47,168,96,93,6,204,94,95,95,94,193,18,129,82,NO
3,IIT DELHI,131,,3078,Trinity Institute of Professional Studies,Sector 9 Dwarka Institutional Area,Metro Pillar No. 1160,,110075,New Delhi,Delhi,160,79,79,36,128,73,71,5,156,72,72,72,72,147,14,98,63,NO
3,IIT DELHI,131,,3079,YP Techno Academy,Plot No. 25/20/2-1 Opp. C.P.J college,Rajeev colony Narela,,110040,New Delhi,Delhi,173,84,84,38,136,79,77,5,165,78,78,78,78,159,15,106,68,YES
3,IIT DELHI,136,,3080,Advanced Institute of Technology and Management,70 Km Delhi-Mathura Road,VPO Village Aurangabad Tehsil Hodal,Distt. Palwal,121105,Palwal,Haryana,237,0,0,100,42,113,68,46,30,0,81,75,36,0,0,0,0,YES
3,IIT DELHI,162,,3081,Sobhasaria Engineering College,NH-11 Gokulpura,Jaipur Road,,332001,Sikar,Rajasthan,310,67,149,105,88,67,148,0,148,171,32,0,219,200,11,183,28,YES
3,IIT DELHI,183,,3082,Pacific Institute of Technology (Pacific University),Pacific Hills Airport Road Debari,Near Transport Nagar,,313024,Udaipur,Rajasthan,273,169,51,30,162,166,50,93,53,143,37,3,176,147,33,115,65,NO
3,IIT DELHI,183,,3083,Geetanjali Institute of Technical Studies,NH-76 Airport Road,Dabok,,313022,Udaipur,Rajasthan,273,163,49,30,162,166,50,96,55,160,41,4,197,164,36,128,72,YES
3,IIT DELHI,184,,3084,Mahakal Institute of Technology ,Behind air strip datana, Dewas Road,,456664,Ujjain,Madhya Pradesh,491,0,0,292,158,229,214,170,55,72,222,237,57,205,9,246,21,NO
3,IIT DELHI,83,,3085,SLBS Engineering College,NH 112  Jodhpur Jaipur Highway,Banwarla Phanta Dangiyawas,,342004,Jodhpur,Rajasthan,119,0,0,0,0,0,0,0,0,0,0,0,0,115,7,92,19,NO
